Title,Price,Neighbourhood,City,Building Area,Land Area,Bedrooms,Bathrooms
"Thriving 2.23 Hectare Farm with Borehole in Norton, Zimbabwe","USD 160,000",Norton,,,,,
Beautiful 7-Bedroom Holiday Home Resort,"USD 500,000",Victoria Falls,,500 m²,,,
Burnside prime 4 acre plot for sale,"USD 210,000",Burnside, Bulawayo East,"1,500 m²",,,
"4-Bedroom Townhouse with Borehole in Harare North, Borrowdale","USD 350,000",Borrowdale, Harare North,350 m²,,,
A neat gardern flat,"USD 135,000",Avondale, Harare North,150 m²,,,
Location! Location! Location!,"USD 950,000",Ryelands, Harare North,800 m²,,,
Luxury Home for Sale in Borrowdale Nyeredzi Ridge,"USD 290,000",Nyeredzi Ridge, Harare North,270 m²,,,
"3-bedroom Home with Borehole in Arlington, Harare South","USD 210,000",Arlington, Harare South,647 m²,,,
Commercial Stand For Sale!!!,"USD 250,000",Whitecliff, Harare West,80 m²,,,
“All You Would Ever Want and More”,"USD 895,000",Mount Pleasant, Harare North,,,,
Unleash Your Vision In The Grange Price Reduced for a Quick Sale,"USD 550,000",The Grange, Harare North,320 m²,,,
Property In Belmont With Great Rental Potential,"USD 500,000",Belmont, Bulawayo CBD,"2,004 m²",,,
Granitiside beautiful apartment for sale,"USD 60,000",Graniteside, Harare South,500 m²,,,
Modern Home/Office,"USD 260,000",Eastlea, Harare East,230 m²,,,
Prime Commercial Property Highlands,"USD 990,000",Highlands, Harare North,750 m²,,,
Spitzkop Vacant Residential Stand for Sale,"USD 11,000",Spitzkop, Harare West,,,,
Hogerty Hill Incomplete House For Sale,"USD 120,000",Hogerty Hill, Harare North,400 m²,,,
"1,700sqm Residential Land","USD 18,000",Norton,,,,,
"Expansive Stand in Prestigious Tawona Estate, Ruwa","USD 40,000",Ruwa,,,,,
A Compact House With A Modern Touch,"USD 380,000",Greendale North, Harare North,,,,
"Stunning 4-Bedroom Home in Glen View 7 , Cession!","USD 50,000",Glen View, Harare High Density,100 m²,,,
"A Developer's Dream. With Great Potential,  in a serene safe,, secure close","USD 250,000",Philadelphia, Harare North,110 m²,,,
Neat Family House For Sale,"USD 120,000",Mainway Meadows, Harare South,300 m²,,,
3-Bed House For Sale In Arlington,"USD 175,000",Arlington, Harare South,,,,
Solid House with a Pool & Borehole in Greendale,"USD 350,000",Greendale, Harare East,,,,
Commerical Property For Sale in Kelvin North,"USD 190,000",Kelvin, Bulawayo CBD,,,,
Hoggerty Hill Stand,"USD 110,000",Hogerty Hill, Harare North,,,,
Modest 3-Bedroom Home With Potential,"USD 95,000",Tynwald, Harare West,140 m²,,,
Price Reduction:Spacious Family Home 20Km From Mutare CBD on 7880sqm!,"USD 120,000",Rezende Street, Penhalonga,200 m²,,,
Exclusive 13 Ac Home Bordering The Umwindsi River,"USD 2,650,000",Helensvale, Harare North,1 m²,,,
Location is everything - nearly the entire block in the CBD for sale,"USD 2,500,000",Bulawayo City Centre, Bulawayo CBD,"4,500 m²",,,
Stand in the esteemed gated Carrick Creagh Community,"USD 110,000",Borrowdale, Harare North,,,,
Elegant Brand New 5 Bedroom Home,"USD 390,000",Gletwin Park, Harare North,300 m²,,,
Grab It And Go,"USD 35,000",Ruwa,,,,,
2 in 1 Double-Story Home For Sale In Chisipite,"USD 1,500,000",Chisipite, Harare North,,,,
"9500m² Residential Land with a 4 bed house For Sale in Hogerty Hill, Borrowdale","USD 550,000",Hogerty Hill, Harare North,,,,
"**Prime 4000m² Stand for Sale in Carrick Creagh, Harare North!**","USD 115,000",Carrick Creagh, Harare North,,,,
A house at a spacious yard for sale in Greendale,"USD 260,000",Greendale, Harare East,,,,
Residential Stand for Sale in Haydon Park,"USD 90,000",Haydon Park, Harare West,,,,
Superb Opportunity,"USD 650,000",Philadelphia, Harare North,,,,
Philadelphia House For Sale,"USD 650,000",Borrowdale, Harare North,"1,000 m²",,,
A Big Residential Stand!!,"USD 185,000",Gletwin Park, Harare North,,,,
Glenlorne: Charming Thatched House for Sale,"USD 460,000",Glen Lorne, Harare North,300 m²,,,
"Prime Commercial/Industrial Land for Sale near Lake Chivero, Mashonaland West","USD 75,000",Lake Chivero,,,,,
Absolute Bargain,"USD 60,000",Kadoma,,,,,
A Tranquil Haven with Extensive Amenities and Garden Oasis!,"USD 310,000",Matsheumhlope, Bulawayo East,,,,
Unit K retail store for sale,"USD 70,000",Chitungwiza,,150 m²,,,
Great investment,"USD 95,000",Chipukutu Park, Ruwa,300 m²,,,
Bluffhill 2 houses on the same yard for sale,"USD 170,000",Bluff Hill, Harare West,600 m²,,,
Good investment,"USD 55,000",Mufakose, Harare High Density,500 m²,,,
Prime Commercial Property for Sale,"USD 1,300,000",Milton Park, Harare West,300 m²,,,
Prime Flat Vacant Stands for Sale – Ready to Build!,"USD 158,000",Philadelphia, Harare North,,,,
Spacious 4-Bedroom Home with Study/5th Bedroom Option,"USD 140,000",Daylesford, Gweru,300 m²,,,
Mandara $320 000,"USD 320,000",Mandara, Harare East,150 m²,,,
Hatfield gated community house for sale,"USD 115,000",Hatfield, Harare South,237 m²,,,
Double-Storey Property With Commercial Potential!,"USD 1,500,000",Mount Pleasant, Harare North,700 m²,,,
"Spacious 4-Bedroom Family Home in Hatcliffe, Harare","USD 55,000",Hatcliffe, Harare High Density,450 m²,,,
"Newly built Arlington Cluster property,3 beds main ensuite,borehole, swimming pool","USD 200,000",Arlington, Harare South,185 m²,,,
Skyport Industrial Park,"USD 450,000",Arlington, Harare South,,,,
Morden Luxury Living,"USD 280,000",The Grange, Harare North,170 m²,,,
Beautiful Complex,"USD 320,000",Strathaven, Harare West,621 m²,,,
**Prime 6 Hectares of Land in Borrowdale Brooke with Full Amenities!**,"USD 1,480,000",Borrowdale Brooke, Harare North,,,,
Unrivalled Views And Location On Carrick Creagh!,"USD 420,000",Carrick Creagh, Harare North,600 m²,,,
Now Selling,"USD 160,000",Vainona, Harare North,117 m²,,,
Pomona Townhouses in Secure Complex,"USD 190,000",Pomona, Harare North,140 m²,,,
Finish To Taste Incomplete Property In Kutandara,"USD 105,000",Tynwald, Harare West,172 m²,,,
Spitzkop Massive Land For Sale,"USD 2,300,000",Spitzkop, Harare West,,,,
"Residential Stands for sale in Bulawayo, Eloana Brooke","USD 180,000",Eloana, Bulawayo South,,,,
Cbd- Mutare,"USD 250,000",Mutare CBD, Mutare,350 m²,,,
Cluster Stands with beautiful views,"USD 130,000",Philadelphia, Harare North,,,,
"Keen seller, ready to transact!","USD 240,000",Mount Pleasant Heights, Harare North,500 m²,,,
**Stunning Cluster Development in Quinnington with Pool & Borehole**,"USD 300,000",Quinnington, Harare North,211 m²,,,
Solid Investment Opportunity Alert!,"USD 2,590,000",Msasa, Harare East,,,,
NEW ON THE MARKET-6 Bedroomed with lots of potential,"USD 195,000",Bluff Hill, Harare West,600 m²,,,
Agro-Residential Plots For Sale In Inyanga,"USD 100,000",Nyanga,,,,,
4 Bed House for sale in Helensvale,"USD 350,000",Helensvale, Harare North,"1,800 m²",,,
Charming Family Home in Great Location,"USD 650,000",Greystone Park, Harare North,400 m²,,,
"Boulders Estate, Ruwa – Residential Grandeur","USD 65,380",Ruwa,,,,,
"Zimre Park Gem ,Versatile Double-Storey Home with Cottage & Staff Quarters.","USD 150,000",Zimre Park, Harare East,"1,000 m²",,,
Spacious 4-Bedroom Home in Christon Bank,"USD 490,000",Christon Bank,,,,,
4 bedroom home in a sought after Carrick Creagh Estate,"USD 270,000",Carrick Creagh, Harare North,,,,
5-Bedroom House For Sale In Monavale,"USD 430,000",Monavale, Harare West,,,,
Individual Stands In Stonechat Lane Complex,"USD 144,495",Greystone Park, Harare North,,,,
Neat Family home,"USD 90,000",Mainway Meadows, Harare South,220 m²,,,
Fourwinds for sale,"USD 120,000",Four Winds, Bulawayo South,,,,
Shawasha Hills - $320k,"USD 320,000",Shawasha Hills, Harare North,,,,
Glamourous Avenues Residence on 2059 Sqm,"USD 320,000",Avenues, Mutare,"1,000 m²",,,
Investment Grade Brand New Modern & Luxurious 2 Beds Apartments For Sale,"USD 152,000",Cnr Alpes & Thames, Vainona,199 m²,,,
Gletwin Park,"USD 155,000",Gletwin Park, Harare North,,,,
NEW LISTING on KINGSMEAD ROAD,"USD 1,190,000",Borrowdale, Harare North,400 m²,,,
Prime 4000sqm stand for sale,"USD 200,000",Gletwin Park, Harare North,,,,
Greystone Park Mansion For Sale,"USD 850,000",Greystone Park, Harare North,"4,078 m²",,,
Kutandara estate house for sale,"USD 119,000",Kutandara, Harare West,200 m²,,,
Beitbridge Hotel For Sale,"USD 2,500,000",Beitbridge,,"23,000 m²",,,
Highlands Flat For Sale,"USD 350,000",Highlands, Harare North,300 m²,,,
Great investment,"USD 450,000",Emerald Hill, Harare West,"1,500 m²",,,
Extremely Neat,"USD 348,000",Highlands, Harare North,400 m²,,,
Multi-functional Industrial Gem,"USD 1,399,000",Donnington, Bulawayo CBD,"28,700 m²",,,
"25 On Thames, Vainona! New Development for the Discerning Buyer","USD 160,000",Thames Road , Vainona,,,,
Commercial property for sale!!!,"USD 780,000",Belgravia, Harare North,,,,
Commercial Block for Sale in CBD Harare on Central Avenue,"USD 1,150,000",Harare City Centre, Harare CBD,"1,300 m²",,,
Stand for sale in Carrick Creagh,"USD 135,000",Carrick Creagh, Harare North,,,,
Your ideal property!,"USD 60,000",Mabelreign, Harare West,150 m²,,,
Versatile Warehouse & Storage in Ruwa with Borehole Access,"USD 250,000",Ruwa,,680 m²,,,
Great Investment Opportunity,"USD 450,000",Tynwald, Harare West,"4,000 m²",,,
"Prime 800sqm Residential Land for Sale in Ruwa, Mashonaland East!","USD 26,000",Ruwa,,,,,
Neat 3 Bedroom Townhouse in Newlands!,"USD 280,000",Newlands, Harare North,,,,
Dont Miss Out On This Fantastic Opportunity,"USD 240,000",Adylinn, Harare West,300 m²,,,
Commercial Property for sale in Bulawayo CBD,"USD 1,600,000",Bulawayo City Centre, Bulawayo CBD,800 m²,,,
Budiriro 2 .Reduced To Go!!,"USD 120,000",Budiriro, Harare High Density,1 m²,,,
Suburbs House for Sale,"USD 295,000",Suburbs, Bulawayo East,,,,
Incomplete Double Storey House For Sale Mount Pleasant Heights,"USD 230,000",Mount Pleasant Heights, Harare North,400 m²,,,
Expansive 2213m² Residential Land in Mount Pleasant Heights!,"USD 125,000",Mount Pleasant Heights, Harare North,,,,
Stunning Retreat Home,"USD 530,000",Victoria Falls,,,,,
"Prime Industrial Stand for Sale in Pomona, Harare North – 2000 m²!","USD 450,000",Pomona, Harare North,,,,
House for Sale : Eastlea,"USD 269,000",Eastlea, Harare East,500 m²,,,
Commercial Building in Kaguvi Street,"USD 400,000",Harare City Centre, Harare CBD,452 m²,,,
Development Opportunity,"USD 175,000",Greendale, Harare East,,,,
Residential Land for Sale – Shawasha Hills,"USD 140,000",Shawasha Hills, Harare North,,,,
3 bedroomed Family Home,"USD 240,000",Arlington, Harare South,240 m²,,,
Subdivision Land with All Paperwork,"USD 160,000",Mandara, Harare East,,,,
Prime Hilltop Residential Stand,"USD 150,000",Glen Lorne, Harare North,,,,
Value for money,"USD 700,000",Goodhope, Harare West,,,,
4 Bedroomed house For Sale In Greendale,"USD 330,000",Greendale, Harare East,,,,
Prime property with development potential! (On Show),"USD 1,400,000",Chisipite, Harare North,600 m²,,,
New on the market,"USD 23,000",Fidelity, Harare South,,,,
"Customize to Your Taste ,Modern Luxury Shell Cluster in Greendale","USD 265,000",Greendale, Harare East,450 m²,,,
Ruwa Springvale Stand for Sale,"USD 45,000",Springvale, Ruwa,,,,
"House for Sale in Crowhill Views, Harare North","USD 50,000",Crowhill Views, Harare North,240 m²,,,
"**Prime 52,000 m² Stand in Sandton Park, Harare West for Sale!**","USD 3,500,000",Sandton Park, Harare West,,,,
Investment opportunity in Pomona,"USD 220,000",Pomona, Harare North,200 m²,,,
Hatfield Clusters,"USD 152,500",Hatfield, Harare South,,,,
A Rare Golden Opportunity!!,"USD 1,400,000",Chisipite, Harare North,500 m²,,,
"3-Bedroom Apartment for Sale in Bluffhill, Harare West","USD 160,000",Bluff Hill, Harare West,400 m²,,,
Agroplot for Sale in Ruwa,"USD 200,000",Ruwa,,,,,
Spacious 3-Bedroom Townhouse Complex with Borehole in Greendale,"USD 221,000",Greendale, Harare East,178 m²,,,
Freshly Renovated Home. Move-In Ready,"USD 320,000",Mandara, Harare East,500 m²,,,
Strathaven – Off Plan Duplex Cluster Homes,"USD 165,000",Strathaven, Harare West,150 m²,,,
Fully Functional Farm for Sale in Figtree,"USD 1,200,000",Umzingwane,,,,,
Reduced To Go,"USD 400,000",Greendale North, Harare North,350 m²,,,
Reduced exceptional 51-hectare agro-residential plot!!,"USD 170,000",Zvimba,,,,,
"Prime 3000m² Residential Plot in Tranquil Greengrove, Harare","USD 170,000",Greendale, Harare East,,,,
Beautiful New Cluster Units with Large Gardens Now Selling Individually,"USD 350,000",Helensvale Road, Helensvale,,,,
Build your dream home: Helensvale Residential Stand for Sale,"USD 280,000",Helensvale, Harare North,,,,
Exclusive Residential Developement In Groom Bridge,"USD 370,000",Groom Bridge, Harare North,205 m²,,,
**Spacious 4-Bedroom Townhouse Complex with Borehole in Adylinn**,"USD 120,000",Adylinn, Harare West,400 m²,,,
Prime 6500? Stand in Gletwin Park with Borehole – Perfect for Your Dream Home!,"USD 300,000",Gletwin Park, Harare North,,,,
Secure Family Home with Unique Character,"USD 140,000",Burnside, Bulawayo East,,,,
Arcturus 7.9 hectare plot for sale,"USD 450,000",Arcturus,,,,,
Prime Location close to Harare Drive,"USD 300,000",Pomona, Harare North,,,,
Build Your Dream Home: Acre Stand in Desirable Brookview,"USD 170,000",Brookview, Harare North,,,,
Borrowdale,"USD 700,000",Borrowdale, Harare North,,,,
Pomona Industrial Land For Sale,"USD 3,500,000",Pomona, Harare North,,,,
Prime 1.6 Hectares of Land in Scenic Christon Bank,"USD 240,000",Christon Bank,,,,,
Coronation Flats For Sale.,"USD 220,000",Greendale, Harare East,,,,
Greystone Park Stand,"USD 150,000",Greystone Park, Harare North,,,,
PRICE REDUCTION:Quaint Corner Home-Renovators Gem On Large Stand!,"USD 170,000",Mabelreign, Harare West,150 m²,,,
Vacant land  for sale,"USD 650,000",Philadelphia, Harare North,,,,
Exquisite 4 bedroom Cluster unit for sale,"USD 300,000",Mount Pleasant, Harare North,,,,
Prestigious Family Home!,"USD 1,980,000",Borrowdale Brooke, Harare North,500 m²,,,
Incomplete house,"USD 70,000",Kadoma,,,,,
"Modern Executive Townhouse US$305k, 3 beds 2 baths.","USD 280,000",Newlands, Harare North,125 m²,,,
Luxurious 4-Bed Townhouse in Marlborough Up For Grabs,"USD 270,000",Marlborough, Harare West,242 m²,,,
"Luxurious upmarket hotel living apartment in Sandton, Johannesburg","USD 130,000",West Street South, Morningside,,,,
Meyrick Park - $200000,"USD 200,000",Meyrick Park, Harare West,,,,
Upmarket Cluster Development in Serene and Secure Neighbourhood.,"USD 280,000",Mount Pleasant, Harare North,206 m²,,,
300square metre  stands Hatcliffe,"USD 21,000",Hatcliffe, Harare High Density,,,,
Nyeredzi Ridge Pomona Stand: Spacious 802m² with Tarred Road Access,"USD 80,200",Pomona, Harare North,,,,
Stands for sale,"USD 220,000",Pomona, Harare North,,,,
Stands for Sale,"USD 60,000",Tynwald, Harare West,,,,
Prime 10ha Agro-Residential Plot For Sale In Ruwa,"USD 350,000",Ruwa,,,,,
Stunning House for sale Madokero,"USD 130,000",Madokero, Harare West,500 m²,,,
"Reduced to sell!!!! Modern, newly built...","USD 175,000",Westgate, Harare West,300 m²,,,
Main Road Frontage-3 Acres Offering Diverse Options!,"USD 1,450,000",Helensvale, Harare North,500 m²,,,
Prime Agro-Residential Plot for Sale – Norton,"USD 140,000",Norton,,,,,
"Spacious 4-Bedroom House for Sale in Glen Norah, Harare!","USD 40,000",Glen Norah, Harare High Density,212 m²,,,
Reduced to Go!!!,"USD 90,000",Ruwa,,,,,
"6738m² Commercial Land for Sale in Marlborough, Harare West","USD 605,000",165 Marlborough , Marlborough,,,,
Fully Serviced Stands,"USD 18,000",Glaudina, Harare West,,,,
"Outstanding property, warehouses and offices","USD 2,200,000",Donnington, Bulawayo CBD,"6,524 m²",,,
Cluster House for Sale in Greendale,"USD 300,000",Greendale North, Harare North,200 m²,,,
"Prime 124,000 m² Land in The Grange, Harare North","USD 2,000,000",The Grange, Harare North,,,,
"Seven Hectares, Prolific Borehole On Jeans Walk Cromlet","USD 550,000",Cromlet, Arcturus,,,,
**Expansive 150 Hectares Farm in Bindura: Prime Agricultural Land!**,"USD 245,000",Bindura,,,,,
"3 Bed, 2 Bath Townhouse Complex in Pomona, Harare","USD 230,000",Pomona, Harare North,168 m²,,,
4 Bedroomed House for Sale in Zimre Park!,"USD 110,000",Zimre Park, Harare East,300 m²,,,
Norton,"USD 7,000",Norton,,,,,
Investors Delight!!,"USD 65,000",Manresa, Harare East,,,,
Redevelopment Property,"USD 140,000",Hatfield, Harare South,200 m²,,,
Reduced to go!!!,"USD 155,000",New Marlborough, Harare West,165 m²,,,
New Built Apartment for sale,"USD 225,000",Greendale, Harare East,300 m²,,,
PHILADELPHIA - $300k,"USD 300,000",Philadelphia, Harare North,,,,
Borrowdale Brookview House,"USD 1,400,000",Borrowdale, Harare North,"4,200 m²",,,
Perfect family home,"USD 210,000",Goodhope, Harare West,100 m²,,,
Prime Victoria Falls Apartment For Sale,"USD 185,000",Victoria Falls,,146 m²,,,
Prime Development Opportunity In Glenlorne,"USD 150,000",Glen Lorne, Harare North,,,,
"Modern, Secure Newly Built Townhouse","USD 170,000",Hillside, Bulawayo South,530 m²,,,
**Premium Stands from 1250 m² for Sale in Rusape!**,"USD 20,000",Rusape,,,,,
Prime 12.8 Hectare Farm Land with Borehole in Ruwa,"USD 1,250,000",Ruwa,,,,,
Luxury Meets Serenity in This Stunning Home in Mt Pleasant Broadlands,"USD 385,000",Mount Pleasant, Harare North,"2,000 m²",,,
"**Stunning 4-Bedroom House with Borehole in Mabvazuva, Ruwa**","USD 115,000",Mabvazuva, Ruwa,198 m²,,,
Avondale West $340000,"USD 340,000",Avondale West, Harare West,300 m²,,,
"Prime Newlands Property For Sale , Harare","USD 450,000",Newlands, Harare North,,,,
Versatile Commercial Property Near Avondale Shops,"USD 295,000",Avondale, Harare North,,,,
Let's go farming,"USD 75,000",Chegutu,,,,,
Your Dream Canvas Awaits!,"USD 350,000",Glen Lorne, Harare North,500 m²,,,
Msasa commercial property for sale,"USD 650,000",Msasa, Harare East,,,,
Prime CBD Commercial Property for Sale,"USD 420,000",Harare City Centre, Harare CBD,230 m²,,,
Charming 2 Bedroom Flat in the Avenues,"USD 73,000",Avenues, Harare CBD,55 m²,,,
Mabelreign House,"USD 165,000",Mabelreign, Harare West,400 m²,,,
Modern Glaudina House -just near Byo RD,"USD 65,000",Glaudina, Harare West,200 m²,,,
**Spacious 2000m² Stand in Gletwin Park with Main Road Access**,"USD 124,000",Gletwin Park, Harare North,,,,
New On The Market...Clusters,"USD 98,500",Chipukutu Park, Ruwa,300 m²,,,
Vainona Cluster Homes: Premium Living Redifined,"USD 600,000",Vainona, Harare North,500 m²,,,
Banket Presents A Unique Investment Opportunity On 8.2 Ha²,"USD 600,000",Banket,,,,,
Elegant Residence - PRICE IMPROVEMENT!,"USD 580,000",Marlborough, Harare West,"1,000 m²",,,
New on the market,"USD 185,000",Borrowdale, Harare North,150 m²,,,
5-Bedroom House For Sale In Carrick Creagh Estate!,"USD 650,000",Carrick Creagh, Harare North,,,,
Rydle Ridge home for same,"USD 65,000",Rydale Ridge Park, Harare West,250 m²,,,
Neat modern Flat!!!,"USD 65,000",Rhodesville, Harare East,,,,
A large commercial property,"USD 600,000",Belmont, Bulawayo CBD,1 m²,,,
Mabvazuva phase 1.1 architectural masterpiece for sale,"USD 150,000",Mabvazuva, Ruwa,450 m²,,,
Mandara stand for sale,"USD 125,000",Mandara, Harare East,,,,
Family Home for Sale in Borrowdale,"USD 550,000",Borrowdale, Harare North,400 m²,,,
Brookview - $350k,"USD 350,000",Brookview, Harare North,620 m²,,,
Ideal Starter Home in Greendale!,"USD 360,000",Greendale, Harare East,300 m²,,,
Plumtree Stand for Sale – 1 Hectare,"USD 120,000",Plumtree,,,,,
Highlands Duplex Clusters for Sale*,"USD 495,000",Highlands, Harare North,400 m²,,,
Finish To Your Own Taste' The 4 Bedroomed House In Haydon Park,"USD 140,000",Haydon Park, Harare West,850 m²,,,
Avondale Office Space for sale,"USD 1,300,000",Avondale, Harare North,,,,
"1,6 Hectare Agro-Residential Plot for Sale in Glen Forest","USD 200,000",Glen Forest, Harare North,,,,
"Road Frontage Chirundu Town; 1,98 Hectares Of Land","USD 685,000",Chirundu,,1 m²,,,
Town House for Sale,"USD 450,000",Newlands, Harare North,220 m²,,,
Farm with Irrigation & Greenhouse in Marondera,"USD 130,000",Marondera,,,,,
"Finish to your taste,3-Bed, 2-Bath Townhouse Complex in Bluff Hill, Harare West","USD 84,000",Bluff Hill, Harare West,150 m²,,,
"Prime 1500 m² Land for Sale in Charlotte Brooke, Harare North","USD 15,000",Charlotte Brooke, Harare North,,,,
Avondale Townhouse In Good Complex with Mature Garden,"USD 245,000",Avondale, Harare North,600 m²,,,
Grand Family Residence with Cottage on 4047sqm,"USD 420,000",Mount Pleasant, Harare North,"4,047 m²",,,
Duplex Flats for Sale (Semi Finished),"USD 130,000",Marlborough, Harare West,100 m²,,,
16 Hectares of Land For Sale in Old Malborough,"USD 2,000,000",Marlborough, Harare West,,,,
Lochinvar Industrail Stand For Sale,"USD 295,000",Lochinvar, Harare South,"1,300 m²",,,
"Spacious 6-Bedroom Home with Borehole in Arlington, Harare South","USD 425,000",Arlington, Harare South,,,,
Granary stands for sale,"USD 18,000",Granary Park, Harare High Density,,,,
"Prime Development Land – Harare Drive, Rolf Valley","USD 9,000,000",Rolf Valley, Harare North,,,,
"Prime 2550 m² Residential Land in Sunway City, Harare with Title Deeds","USD 68,000",Sunway City, Harare East,,,,
Investment Opportunity in Greendale,"USD 390,000",Greendale, Harare East,380 m²,,,
Spacious 5-Bedroom Double-Storey Home with Cottage and Double Garage,"USD 160,000",Zimre Park, Harare East,500 m²,,,
Stand for sale,"USD 125,000",Marlborough, Harare West,,,,
Perfect family home,"USD 85,000",Zimre Park, Harare East,120 m²,,,
"5-Bedroom Architectural thatched double storey for Sale in Hogerty Hill, Harare North","USD 1,200,000",Hogerty Hill, Harare North,,,,
Greendale North House for Sale Facing Eastern Road (Harare Drive),"USD 350,000",Greendale North, Harare North,250 m²,,,
Dont Miss Out On This Fantastic Opportunity,"USD 265,000",Hatfield, Harare South,500 m²,,,
"Commercial Property for Sale in Belgravia, Harare North!","USD 485,000",Belgravia, Harare North,,,,
Hotel For Sale,"USD 1,350,000",Avenues, Harare CBD,650 m²,,,
Avonlea Extension (New Development),"USD 140,000",Avonlea, Harare West,220 m²,,,
A 3000 Sqm Beautifully Treed Plot,"USD 250,000",Borrowdale, Harare North,,,,
Exquisite 3 Bed Cluster in Greendale ( Choice of 2 ),"USD 145,000",Greendale, Harare East,150 m²,,,
Solar Powered 3-Bedroom House for Sale in Glaudina with Developer’s Cession,"USD 55,000",Glaudina, Harare West,,,,
Flamboyant Double Storey In The Hills,"USD 520,000",Hogerty Hill, Harare North,450 m²,,,
Build your dream home on this flat 4082sqm land.,"USD 350,000",Borrowdale, Harare North,,,,
Value for money,"USD 1,200,000",Selous,,,,,
True Gem In Secure Complex,"USD 400,000",Chisipite, Harare North,,,,
Milton Park - $675000,"USD 675,000",Milton Park, Harare West,,,,
Stand for Sale,"USD 30,000",Knowe, Norton,,,,
"Prime 7211sqm Stand in Crowhill – Road Frontage, Water Access & Gentle Slope","USD 320,000",Crowhill Views, Harare North,,,,
New Listing in Glen Lorne,"USD 1,350,000",Glen Lorne, Harare North,480 m²,,,
Chinhoi Alaska Farm,"USD 900,000",Chinhoyi,,,,,
"2100m² Residential Land in Arlington,Deed available, Harare South","USD 115,000",Arlington, Harare South,,,,
"42 Hectare Farm & Agricultural Land for Sale in Glen Forest, Harare North","USD 4,500,000",Glen Forest, Harare North,,,,
Incomplete mansion for sale in Gumtree,"USD 350,000",Gumtree, Bulawayo East,"1,000 m²",,,
4 bed family home,"USD 260,000",Bluff Hill, Harare West,250 m²,,,
Finish It To Your Taste,"USD 400,000",Arlington, Harare South,800 m²,,,
Residential Stand -Gold Dust!!!!!,"USD 80,000",Mazvikadei,,,,,
"Prime 4-Acre Agricultural Land for Sale in Ruwa, Zimbabwe","USD 63,000",Ruwa,,,,,
Elegant Belvedere Home with Modern Comforts,"USD 290,000",Belvedere, Harare West,800 m²,,,
3 Bedroomed House for Sale in Westgate,"USD 210,000",Westgate, Harare West,450 m²,,,
"Spacious 16,000 m² Farm Land in Norton with Road Frontage.","USD 62,000",Norton,,,,,
"Test Listing, please ignore!!","USD 100,000",Amby, Harare East,250 m²,,,
Charming Waneka Flat: 2-Bedroom Gem with Fitted Kitchen,"USD 46,000",Mbare, Harare High Density,100 m²,,,
Philadelphia – Spacious 5-Bedroom Home on 5.4 Acres,"USD 800,000",Philadelphia, Harare North,4 m²,,,
Nyabira stand ready to built electricity available and roads,"USD 12,000",Nyabira,,,,,
Stunning 4-Bedroom Townhouse Complex with Borehole in Marlborough,"USD 200,000",Marlborough, Harare West,197 m²,,,
"Warehouse & Factory in Southerton for sale, Harare","USD 1,850,000",Southerton, Harare South,,,,
Newly Built 3 Bedrooms,"USD 98,500",Rainham, Harare West,180 m²,,,
**Prime 2500 m² Stand for Sale in Exclusive Borrowdale**,"USD 125,000",Borrowdale, Harare North,,,,
Spitzkop,"USD 1,400,000",Spitzkop, Harare West,"20,000 m²",,,
The Strand office land in Borrowdale.,"USD 875,000",Borrowdale, Harare North,,,,
Residential house for sale,"USD 850,000",Borrowdale, Harare North,300 m²,,,
Goromonzi Commercial Property For Sale,"USD 130,000",Goromonzi,,800 m²,,,
Small Warehouse In New Ardbennie,"USD 95,000",Southerton, Harare South,100 m²,,,
Modern Family Living – 4-Bedroom Beauty For Sale,"USD 130,000",Madokero, Harare West,230 m²,,,
Neat and Massive,"USD 270,000",Belvedere, Harare West,600 m²,,,
"Quinnington Borrowdale , Luxury 4-Bed Double-Storey Cluster Homes","USD 350,000",Quinnington, Harare North,500 m²,,,
Amazing Opportunity!,"USD 3,500,000",Steeldale, Bulawayo CBD,,,,
"Zimre Park Fixer-Upper – $80,000","USD 80,000",Zimre Park, Harare East,350 m²,,,
Prime Industrial Warehouse & Factory with Borehole in Bulawayo,"USD 1,200,000",Belmont, Bulawayo CBD,,,,
Beautiful Views To Build Your Dream Home,"USD 997,000",Glen Lorne, Harare North,,,,
