Title,Price,Neighbourhood,City,Building Area,Land Area,Bedrooms,Bathrooms
Ilanda house for sale,"USD 149,000",Ilanda, Bulawayo East,,,,
"Hilside remodelled, prime area","USD 240,000",Hillside, Bulawayo South,1 m²,,,
Modern 3-Bedroom Duplex Flat for Sale,"USD 160,000",Madokero, Harare West,100 m²,,,
Commercial offices Bulawayo,"USD 350,000",Bulawayo City Centre, Bulawayo CBD,1 m²,,,
"PRICE REDUCTION !!!Prime 800m² Stand in Borrowdale, Pomona City","USD 78,000",Borrowdale, Harare North,,,,
Warren Park House for Sale,"USD 60,000",Warren Park, Harare High Density,250 m²,,,
Prime Development Opportunity – Original Farmhouse On 3 Acres,"USD 1,500,000",Avondale, Harare North,400 m²,,,
Service Station for sale,"USD 2,500,000",Glaudina, Harare West,"4,500 m²",,,
"Kensington Property for Sale-Space, Comfort and Potential","USD 140,000",Kensington, Bulawayo East,250 m²,,,
Only 3 Units Left!  Move-In Ready Homes!,"USD 370,000",Mount Pleasant, Harare North,205 m²,,,
"Prime Warehouse & Factory for Sale in Prospect, Harare South","USD 300,000",Prospect, Harare South,280 m²,,,
Ideal For Commercial Use!!,"USD 170,000",Braeside, Harare South,150 m²,,,
Prime Investment Property in Old Alex Park!,"USD 410,000",Alexandra Park, Harare North,250 m²,,,
Reduced to Go!!,"USD 270,000",Newlands, Harare North,100 m²,,,
Jetway Industrial Park is an exciting New Mixed Use Development.,"USD 170,000",Airport, Harare South,,,,
"Bold Architecture, Big Yard, Beautiful Living In Suburbs!","USD 350,000",Suburbs, Bulawayo East,,,,
Historic Hotel Centrally Located,"USD 1,199,000",Bulawayo City Centre, Bulawayo CBD,,,,
"Prime 15.2-Acre Land in Kadoma, Mashonaland West","USD 800,000",Kadoma,,,,,
Commercial Building In The Cbd,"USD 6,500,000",Cnr Speke & 1St Street, Harare City Centre,,,,
Endless Possibilities,"USD 195,000",Famona, Bulawayo South,0 m²,,,
Residential Stands with Title deeds in a Gated Estate,"USD 37,100",Tynwald, Harare West,,,,
Bulawayo CBD 1950,"USD 1,950,000",Bulawayo City Centre, Bulawayo CBD,1 m²,,,
Family Home for Sale in Waterfalls,"USD 130,000",Waterfalls, Harare South,,,,
Luxury Mansion in Glen Lorne Folly John,"USD 520,000",Glen Lorne, Harare North,,,,
Gletwin Stand For Sale,"USD 100,000",Gletwin Park, Harare North,,,,
Luxury Living with Solar & Borehole.,"USD 225,000",Mount Pleasant Heights, Harare North,900 m²,,,
"Glen Lorne. $870K. 8,200sqm. Infinite Possibility","USD 870,000",Glen Lorne, Harare North,"6,000 m²",,,
"Prime 2,000sqm Residential Stands for Sale in The Grange – Off Drew Road","USD 150,000",The Grange, Harare North,,,,
Nguboyenya,"USD 30,000",Nguboyenja, Bulawayo High-Density,1 m²,,,
Aspindale house for sale,"USD 95,000",Aspindale Park, Harare West,150 m²,,,
Prime Commercial Property for Sale in Bindura,"USD 550,000",Bindura,,,,,
Avenues 2 bed flat up for grabs!,"USD 55,000",Harare City Centre, Harare CBD,150 m²,,,
A Prestigious Family Home in Ryelands,"USD 950,000",Ryelands, Harare North,,,,
Mvuma Orangia,"USD 70,000",Mvuma,,,,,
4 Bedroom House in Mabelreign,"USD 145,000",Mabelreign, Harare West,"1,805 m²",,,
Mount Pleasant Heights House For Sale,"USD 430,000",Mount Pleasant Heights, Harare North,"2,245 m²",,,
Stylishly-Polished home!!!,"USD 295,000",Greendale North, Harare North,400 m²,,,
Spacious Family Home with Cottages for Sale.,"USD 165,000",Waterfalls, Harare South,"4,047 m²",,,
"Cozy 3 Bedroom Cluster House in Greendale, Peakwood Gated Community!","USD 220,000",Greendale, Harare East,200 m²,,,
warehouse for sale in lochinvar,"USD 180,000",Lochinvar, Harare South,500 m²,,,
Property With Development Potential,"USD 150,000",Hatfield, Harare South,"2,000 m²",,,
"Charming 4-Bedroom House for Sale in Kuwadzana, Harare","USD 50,000",Kuwadzana, Harare High Density,160 m²,,,
Ironstone Industrial Park,"USD 190,000",Arlington, Harare South,,,,
"Residential Land For Sale In Sandton Phase 3, Harare","USD 38,000",Sandton Park, Harare West,,,,
Newly Listed,"USD 180,000",Arlington, Harare South,250 m²,,,
Build a mega factory or warehouse on this huge piece of land in Msasa,"USD 600,000",Msasa, Harare East,,,,
"Spacious 4-Bedroom House for Sale in Walled Seke, Mashonaland East","USD 32,000",Chitungwiza,,,,,
Chicago township house for sale,"USD 90,000",KweKwe, Kwekwe,300 m²,,,
Grand Double Storey House For Sale In Borrowdale,"USD 950,000",Borrowdale, Harare North,,,,
Chitungwiza,"USD 20,000",Chitungwiza,,,,,
"4-Bedroom Home with Extras – Great Potential, Secure Title.","USD 250,000",Mount Pleasant Heights, Harare North,300 m²,,,
Don't miss out!!!,"USD 220,000",Strathaven, Harare West,450 m²,,,
"Expansive 17,000m² Plot Land in Glen Forest, Harare North","USD 170,000",Glen Forest, Harare North,,,,
Massive investment in a mature in the heart of sought-after industrial area,"USD 2,500,000",Bulawayo City Centre, Bulawayo CBD,"110,000 m²",,,
"Charming 3-Bed Flat Cluster with Borehole in Greendale, Harare","USD 215,000",Greendale, Harare East,120 m²,,,
Mhondoro Ngezi turf  Stands For Sale,"USD 7,000",Mhondoro Ngezi,,,,,
Newly built house in Marimba IDBZ Project,"USD 95,000",Marimba Park, Harare High Density,180 m²,,,
Let's go farming,"USD 600,000",Cromlet, Arcturus,,,,
Your ideal property!,"USD 100,000",Marlborough, Harare West,100 m²,,,
Solid 3 bed 3 bath property in great location.,"USD 405,000",Glen Lorne, Harare North,290 m²,,,
Spacious 7Th Floor Apartment - Northfields,"USD 600,000",Avenues, Harare CBD,1 m²,,,
Retail Space in The CBD,"USD 42,000",Harare City Centre, Harare CBD,20 m²,,,
"Prime 21,280 m² Residential Land for Sale in Norton, Zimbabwe!","USD 72,000",Norton,,,,,
"Mainroad frontage, Corner Property","USD 180,000",Darlington, Mutare,150 m²,,,
Glen Lorne Folly Jon,"USD 550,000",Glen Lorne, Harare North,"2,000 m²",,,
Charming 3 bedroom cottage,"USD 65,000",Ruwa,,80 m²,,,
Agro-Residential Plots In Inyanga,"USD 40,000",Nyanga,,,,,
"3BR Family House with Premium Amenities in Zengeza 5, Chitungwiza","USD 38,000",Zengeza, Chitungwiza,150 m²,,,
"Prime Residential Stand for Sale – Luna Road, Borrowdale","USD 250,000",Borrowdale Brooke, Harare North,,,,
Braeside $140000,"USD 140,000",Braeside, Harare South,120 m²,,,
Reduced to Go: Beatrice/Featherstone Farm For Sale 140 Hectares,"USD 300,000",Beatrice,,,,,
Commercial Hub!,"USD 3,500,000",Bulawayo City Centre, Bulawayo CBD,,,,
Agro-Residential Plot for Sale,"USD 55,000",Norton,,,,,
Work-Ready Industrial Site- Perfect for Expansion or Investment.,"USD 400,000",Steeldale, Bulawayo CBD,"1,245 m²",,,
Riddle Ridge house for sale,"USD 70,000",Rydale Ridge Park, Harare West,250 m²,,,
Well Maintained 4 Bedroom Home,"USD 410,000",Alexandra Park, Harare North,300 m²,,,
"Nyanga Lodge: Spacious, Furnished & Borehole Equipped Oasis","USD 710,000",Nyanga,,"8,000 m²",,,
8.25 Ha Plot In Banket With 3 Boreholes,"USD 570,000",Banket,,,,,
Mount Pleasant,"USD 1,500,000",Mount Pleasant, Harare North,,,,
Stunning New 4 Bedroom Townhouse Development on Kent Road,"USD 425,000",Kent Road, Highlands,317 m²,,,
Emganwini Valley Medium Residential  Stands for Sale,"USD 18,000",Emganwini, Bulawayo High-Density,,,,
Make your dreams come true!,"USD 210,000",Waterfalls, Harare South,500 m²,,,
Quinnington Stand For Sale,"USD 80,000",Quinnington, Harare North,,,,
Prime land with sewer connection - suitable for development of flats by special consent,"USD 220,000",Ardbennie, Harare South,,,,
Commercial Property - Mount Pleasant - PRIME LOCATION,"USD 450,000",Mount Pleasant, Harare North,"2,500 m²",,,
Versatile property in the sought-after area of Alexandra Park,"USD 580,000",Alexandra Park, Harare North,400 m²,,,
Breath takingly Beautiful,"USD 162,000",Nyanga,,,,,
House for sale,"USD 110,000",Whitecliff, Harare West,500 m²,,,
Exclusive 4-Bed Townhouse with Borehole in Carrick Creagh,"USD 250,000",Carrick Creagh, Harare North,,,,
Hatfield Stand,"USD 45,000",Hatfield, Harare South,,,,
Discover This Incredible Townhouse in Northend .,"USD 115,000",Northend, Bulawayo North,,,,
Tigerkloof. Mutare,"USD 490,000",Tiger's Kloof, Mutare,300 m²,,,
Lower Rangemore Development!!!!,"USD 6,000",Lower Rangemore, Bulawayo High-Density,,,,
Upmarket Townhouses Now Selling,"USD 290,000",Vainona, Harare North,200 m²,,,
"Lovely, newly built townhouses for sale (NOSTRO IS ACCEPTED)","USD 428,400",Windmill Lane, Helensvale,,,,
"Spacious 3 Bed Cottage  on 2200 m² in Galloway, Norton! For sale","USD 45,000",Galloway, Norton,,,,
Sophisticated Living!,"USD 1,700,000",Gunhill, Harare North,904 m²,,,
Commercial Hub Investment!,"USD 750,000",Bulawayo City Centre, Bulawayo CBD,,,,
Superb Opportunity,"USD 300,000",Gletwin Park, Harare North,,,,
"For Sale: 8-Roomed House – Pelandaba, Bulawayo","USD 25,000",Pelandaba, Bulawayo High-Density,150 m²,,,
Elegant Double Storey Home,"USD 950,000",Ryelands, Harare North,600 m²,,,
Cosy House in Tshovani Chiredzi,"USD 22,000",Chiredzi,,340 m²,,,
Mt pleasent heights house for sale,"USD 450,000",Mt Pleasant Heights, Harare West,491 m²,,,
"Charming Mountain Retreat for Sale – Nyanga, Zimbabwe","USD 280,000",Nyanga,,250 m²,,,
Borrowdale North Stand,"USD 399,000",Borrowdale, Harare North,,,,
Finish it to your own taste!,"USD 125,000",Rockview, Harare East,500 m²,,,
Subdivision,"USD 110,000",Burnside, Bulawayo East,,,,
Family home with wonderful potential,"USD 480,000",Highlands, Harare North,300 m²,,,
"3-Bedroom House  For Sale In  Marlborough, Harare West","USD 220,000",Marlborough, Harare West,,,,
Prime commercial/Industrial stand for Sale!!,"USD 1,200,000",Ardbennie, Harare South,,,,
Architecturally designed double storey home For Sale,"USD 650,000",Carrick Creagh, Harare North,800 m²,,,
Neat as a pin,"USD 90,000",Marimba Park, Harare High Density,400 m²,,,
Famona House for sale,"USD 125,000",Famona, Bulawayo South,,,,
Mabvazuva Beautiful Stand,"USD 35,000",Mabvazuva, Ruwa,,,,
Prime Development Property for Sale,"USD 650,000",Greendale, Harare East,"7,899 m²",,,
House For Sale In Arcadia,"USD 90,000",Arcadia, Harare South,250 m²,,,
Newly Built- Ashdown Falcon's Finest,"USD 140,000",Ashdown Park, Harare West,220 m²,,,
Residential stand for sale,"USD 35,000",Mabvazuva, Ruwa,,,,
Lifetime Opportunity!!!,"USD 250,000",Greendale, Harare East,600 m²,,,
Residential stand for sale,"USD 95,000",Carrick Creagh, Harare North,,,,
Prime Retail Shopping Centre In Mabelreign,"USD 1,300,000",Mabelreign, Harare West,"1,373 m²",,,
Ideal for investment.,"USD 225,000",Marlborough, Harare West,180 m²,,,
Investment opportunity!!,"USD 135,000",Avenues, Harare CBD,81 m²,,,
Rydale ridge house for sale,"USD 65,000",Rydale Ridge Park, Harare West,290 m²,,,
Fixer Upper Ideal For Commercial Use,"USD 360,000",Milton Park, Harare West,200 m²,,,
Gunhill double storey  4beds  with balcon all ensuite,"USD 650,000",Gunhill, Harare North,,,,
A House In a Prime Location In Chinhoyi,"USD 115,000",Chinhoyi,,250 m²,,,
Best townhouse value,"USD 220,000",Mount Pleasant, Harare North,200 m²,,,
17 Acre well equipped Agro Residential Plot - 2.4KM away from Mutare Road/Goromonzi turn off,"USD 520,000",Goromonzi,,,,,
Trenance 6 bedroomed house for sale on 4000 sqm,"USD 78,000",Trenance, Bulawayo North,,,,
Lendy Park,"USD 36,000",Marondera,,,,,
"Great area, excellent value","USD 95,000",Bluff Hill, Harare West,90 m²,,,
Prime Office And Warehouse  Property,"USD 375,000",Donnington, Bulawayo CBD,,,,
Borrowdale Stand Along Crowhill Road 7200sqm,"USD 290,000",Borrowdale Brooke, Harare North,,,,
Plot for sale,"USD 250,000",Goromonzi,,,,,
Agro-Residential Plots For Sale In Inyanga,"USD 200,000",Nyanga,,,,,
Industrial Powerhouse in Ruwa!,"USD 280,000",Ruwa,,700 m²,,,
Strategic Corner Stand in the CBD – Warehouse & Workshop,"USD 420,000",Bulawayo City Centre, Bulawayo CBD,602 m²,,,
Spacious 3 Bedroom Property in Chisipite,"USD 480,000",Chisipite, Harare North,200 m²,,,
Super Starter Pack Offering Oodles of Opportunities!,"USD 300,000",Greendale, Harare East,175 m²,,,
Warehouses Chiredzi Depot 9629sqm,"USD 420,000",Chiredzi,,,,,
"Spacious 5-Bedroom Family Home with Borehole in Mabelreign, Maranatha Park ,Harare","USD 145,000",Mabelreign, Harare West,800 m²,,,
Live in Grandeur in the Folyjon Estate Reduced for a Quick Sale,"USD 640,000",Folyjon Cres, Glen Lorne,460 m²,,,
A Feel Good Family Home Amongst Leafy Serenity,"USD 180,000",Suburbs, Bulawayo East,,,,
Commercial property for sale,"USD 600,000",Southerton, Harare South,"1,243 m²",,,
Investment Opportunity. Reduced!,"USD 335,000",Marondera,,,,,
"Prime 400m² Residential Land for Sale in Gweru, Midlands","USD 14,950",Gweru CBD, Gweru,,,,
Great Investment. Wonderful location,"USD 400,000",Highlands, Harare North,250 m²,,,
Reduced to Go- located along Suffolk Road,"USD 220,000",Avondale West, Harare West,260 m²,,,
Sawara Hill Crowhill Stands For Sale,"USD 18,750",Crowhill Views, Harare North,,,,
Ready for development,"USD 2,500,000",Waterfalls, Harare South,,,,
Vainona Gem/Campbell Place: Spacious 3-Beds Home in Harare,"USD 230,000",Vainona, Harare North,200 m²,,,
"Westview, Kadoma","USD 75,000",Kadoma,,200 m²,,,
Serene 4-Bedroom Garden Flat in Chisipite with Borehole!,"USD 425,000",Chisipite, Harare North,300 m²,,,
Residential Stand for Sale – Whitecliff,"USD 48,000",Whitecliff, Harare West,,,,
Prime Commercial Property for Sale,"USD 800,000",Avenues, Harare CBD,,,,
*REDUCED* Double-Storey Home in a Prime Location within Borrowdale Brooke Golf Estate,"USD 1,300,000",Borrowdale Brooke, Harare North,500 m²,,,
Residential Stands now available in Shurugwi,"USD 27,600",Shurugwi,,,,,
Mandara 3 bed house for Sale,"USD 330,000",Mandara, Harare East,250 m²,,,
Braeside Home For Sale!,"USD 105,000",Braeside, Harare South,,,,
Neat Reduced to go,"USD 76,500",Kutandara, Harare West,280 m²,,,
Residential Land For Sale,"USD 35,000",Ruwa,,,,,
Granary house for sale,"USD 45,000",Granary Park, Harare High Density,200 m²,,,
Neat Double Storey House on Borrowdale Brooke Drive near Blue Roof,"USD 395,000",Helensvale, Harare North,400 m²,,,
Kensington apartment for sale - 230kneg,"USD 230,000",Kensington, Harare West,150 m²,,,
Glen View Commercial Building,"USD 211,000",Glen View, Harare High Density,300 m²,,,
Double Storey,"USD 150,000",Southlea Park, Harare South,300 m²,,,
Factory/Warehouse For Sale In Chitungwiza. Investment Opportunity!,"USD 715,000",Chitungwiza,,"1,500 m²",,,
Borrowdale Pomona 3 Beds Clusters for Sale,"USD 230,000",Borrowdale West, Harare North,125 m²,,,
Grand Gletwyn Gem – Expansive 3700sqm Stand,"USD 180,000",Gletwin Park, Harare North,,,,
Land For Sale,"USD 60,000",Umguza,,,,,
Norton Land,"USD 140,000",Norton,,,,,
Belvedere Ridgeview House for sale,"USD 290,000",Ridgeview, Harare West,400 m²,,,
4.4 Hectares Agro Land 60km from Harare,"USD 150,000",Marondera,,,,,
Spacious 12-Bedroom Home with Borehole in Mount Pleasant Heights,"USD 280,000",Mount Pleasant Heights, Harare North,625 m²,,,
Incomple 4 beds on 2000sqm,"USD 130,000",Arlington, Harare South,,,,
"200sqm stand in southview fidelity park , developer cession 14.5k , tarred roads","USD 14,500",Southview Park, Harare South,,,,
Nyabira low density Paarl luna estate stands for sale,"USD 30,000",Nyabira,,,,,
"Prime Residential Stand for Sale – Mahatshula, Bulawayo","USD 18,500",Mahatshula, Bulawayo North,,,,
"Helensvale Elegance Awaits!,Starter Homes in a Leafy Suburb","USD 400,000",Helensvale, Harare North,"2,000 m²",,,
"Views, Vibes &Value. Burnside!","USD 130,000",Burnside, Bulawayo East,,,,
"**Prime 1500 m² Land in Sandton Park, Harare West – Your Dream Awaits!**","USD 36,000",Sandton Park, Harare West,,,,
Investment Opportunity,USD 75,Upfront, Ruwa,,,,
"Comfort, Luxury & Elegance in Highlands","USD 385,000",Highlands, Harare North,212 m²,,,
"Stunning Property Near 2nd Street Ext ,Old Marlbrough","USD 350,000",Marlborough, Harare West,320 m²,,,
Exceptional Investment Opportunity,"USD 210,000",Burnside, Bulawayo East,,,,
Rydale Ridge Property for Sale,"USD 70,000",Rydale Ridge, Harare High Density,,,,
Scenic Escape On Gletwyn Dam,"USD 990,000",Glen Lorne, Harare North,"1,000 m²",,,
"Land For Sale-1 Hectare, Glen Lorne","USD 450,000",Glen Lorne, Harare North,,,,
Invest in your future,"USD 25,000",Msasa, Harare East,,,,
Greyston Park Stand For Sale,"USD 156,000",Greystone Park, Harare North,,,,
glenlorn prime land,"USD 260,000",Glen Lorne, Harare North,,,,
Solid Investment Opportunity Alert!,"USD 2,590,000",Msasa, Harare East,"1,586 m²",,,
Hatfield 3 Bedroom house for sale... Opposite Arlington east,"USD 160,000",Hatfield, Harare South,350 m²,,,
"Residential stand for sale - Tawona Park, Ruwa","USD 34,000",Ruwa,,,,,
Prime 229m² Stand in Greystone Park with Borehole,"USD 65,000",Greystone Park, Harare North,,,,
Stunning 3-Bedroom Townhouse in Vainona with Borehole!,"USD 250,000",Vainona, Harare North,139 m²,,,
Unique Family Home Mount Pleasant Heights,"USD 200,000",Mount Pleasant Heights, Harare North,,,,
A Boutique Lifestyle Development,"USD 370,000",Borrowdale Brooke, Harare North,199 m²,,,
"Prime 3,441sqm Stand For Sale In Gletwin","USD 172,050",Gletwin Park, Harare North,,,,
Borrowdale Brooke Stand for Sale,"USD 390,000",Borrowdale Brooke, Harare North,,,,
Stunning Montrose | Bulawayo Property,"USD 100,000",Montrose, Bulawayo South,"1,125 m²",,,
"Prime 2000m² Residential Land for Sale in Pomona, Harare North","USD 70,000",Pomona, Harare North,,,,
"Elegant 5-Bedroom House for Sale in Glen Lorne, Harare North","USD 710,000",Glen Lorne, Harare North,488 m²,,,
Build yours,"USD 38,000",Tynwald, Harare West,,,,
Eastlea Along Samora Machel Tranquil Home For Sale,"USD 690,000",Eastlea, Harare East,800 m²,,,
Your ideal property!,"USD 100,000",Old Windsor, Ruwa,450 m²,,,
Live your dream lifestyle in Carrick Creagh Estate!,"USD 150,000",Borrowdale, Harare North,,,,
Old Marlborough house for sale,"USD 290,000",Marlborough, Harare West,400 m²,,,
Chitungwiza Unit N Extension,"USD 26,000",Chitungwiza,,100 m²,,,
AMTON PLACE- Only 1 Unit Available!,"USD 345,000",Northwood, Harare North,540 m²,,,
Hidden Gem With Scenic Views!!!!!!,"USD 597,000",Borrowdale Brooke, Harare North,,,,
Gweru Nehosho 4-bedroom house for sale,"USD 36,000",Nehosho, Gweru,150 m²,,,
Manresa $60 000,"USD 60,000",Manresa, Harare East,,,,
Finish To Your Own Taste,"USD 360,000",The Grange, Harare North,850 m²,,,
1900s HOME IN POPULAR AVONDALE,"USD 1,300,000",Avondale, Harare North,276 m²,,,
Prime land for sale in Gletwin Park,"USD 173,000",Gletwin Park, Harare North,,,,
Reduced - Solid Home in Khumalo with main Road Frontage,"USD 170,000",Kumalo, Bulawayo East,,,,
Carrick Creagh's Finest- Luxurious Mansion,"USD 3,000,000",Carrick Creagh, Harare North,320 m²,,,
Cluster stand in prime location,"USD 76,000",Quinnington, Harare North,,,,
Versatile Property with Visibility from Seke Road,"USD 160,000",Hatfield, Harare South,150 m²,,,
**Prime 450 m² Stands in Arcadia: Your Future Awaits!**,"USD 35,000",Arcadia, Harare South,,,,
Expand Your Horizons -Your Canvass For Success,"USD 899,000",Donnington, Bulawayo CBD,,,,
Prime Residential Stands for Sale along ED Mnangagwa [Enterprise] Road,"USD 255,000",Glen Lorne, Harare North,,,,
House for sale,"USD 130,000",Bluff Hill, Harare West,200 m²,,,
Strategic Gweru CBD Property – Corner Location,"USD 2,700,000",Gweru CBD, Gweru,"4,000 m²",,,
Fully Developed Stand/Plot,"USD 240,000",Christon Bank,,,,,
Residential stand for sale,"USD 120,000",Belvedere, Harare West,,,,
Commercial Property In Unit L Chitungwiza,"USD 120,000",Chitungwiza,,120 m²,,,
Greystone Park – Double-Storey Home on 1 Acre,"USD 680,000",Greystone Park, Harare North,800 m²,,,
Well treed and serene land,"USD 1,100,000",Marlborough, Harare West,,,,
Charming 3-Bedroom Home in Murewa Town Centre!,"USD 20,000",Murehwa,,200 m²,,,
Ready for Investment,"USD 250,000",Sandton Park, Harare West,,,,
Elegant 4-Bedroom Home with a Solar back up power system in Prestigious Kennedy Dr (On Show),"USD 390,000",Greendale, Harare East,200 m²,,,
Massive 3 Hectare Warehouse & Factory For Sale in Bindura,"USD 590,000",Bindura,,"30,000 m²",,,
"Charming 3-Bed Townhouse in Groom Bridge with Borehole, ready for occupation.","USD 370,000",Groom Bridge, Harare North,,,,
Renovator's Delight in The Grange,"USD 290,000",The Grange, Harare North,300 m²,,,
Smart Investment Opportunity in Ashdon Park – Affordable Flats in a Secure Complex,"USD 85,000",Ashdown Park, Harare West,"3,000 m²",,,
8 Bedroom House On 1Acre Along Harare Drive,"USD 850,000",Borrowdale, Harare North,900 m²,,,
Simplex townhouses,"USD 150,000",Kumalo, Bulawayo East,125 m²,,,
"1300 m² Land for Sale in Norton, Mashonaland West","USD 25,000",Norton,,,,,
Waterland - Corner Property - Investor's Gem,"USD 1,900,000",Chitungwiza,,,,,
Commercial Property for sale,"USD 75,000",Southlea Park, Harare South,300 m²,,,
Industrial Stands for Sale,"USD 397,000",Tynwald, Harare West,,,,
"Mt Pleasant, near Arundel Village townhouse for sale","USD 300,000",Mount Pleasant, Harare North,207 m²,,,
Waterfalls Zindoga Commercial Property Available,"USD 300,000",Waterfalls, Harare South,325 m²,,,
Borrowdale Carrick creagh Estate,"USD 650,000",Carrick Creagh, Harare North,350 m²,,,
Superb Opportunity,"USD 160,000",Madokero, Harare West,,,,
"Elegant 6-Bedroom Home for Sale in Philadelphia, Borrowdale","USD 410,000",Philadelphia, Harare North,300 m²,,,
Tynwald solid gem for sale near Madokero Mall,"USD 215,000",Tynwald, Harare West,500 m²,,,
*Highlands 4-Bed Double story for Sale*,"USD 350,000",Highlands, Harare North,300 m²,,,
Prime land in a quite surbub,"USD 48,000",Willsgrove, Bulawayo East,,,,
"Solid Start in Arlington Estate ,2000sqm Stand with Slab & Cottage","USD 120,000",Arlington, Harare South,,,,
Extremely Beautiful,"USD 145,000",Mabvazuva, Ruwa,200 m²,,,
Investment Opportunity,"USD 120,000",Avondale, Harare North,300 m²,,,
Commercial land for sale,"USD 530,000",Prospect, Harare South,,,,
Groombridge town house for sale,"USD 230,000",Groom Bridge, Harare North,300 m²,,,
Dream home alert!,"USD 105,000",Msasa, Harare East,400 m²,,,
Cluster home for Sale- Waterfalls FBC Complex Phase 1,"USD 130,000",Waterfalls, Harare South,120 m²,,,
Prime Warehouse Investment In Graniteside,"USD 1,200,000",Graniteside, Harare South,"2,230 m²",,,
Upper Rangemore Opportunity.,"USD 6,000",Upper Rangemore, Bulawayo High-Density,,,,
Investment Opportunity,"USD 90,000",Newlands, Harare North,50 m²,,,
Chadcom property for sale,"USD 115,000",Chadcombe, Harare South,100 m²,,,
"Prime 500m² and 1700m2 Residential Land for Sale, Carrick Creagh, Harare:","USD 78,000",Carrick Creagh, Harare North,,,,
Neat as a pin,"USD 105,000",Waterfalls, Harare South,220 m²,,,
Choice of 2 Stands measuring 2090sqm,"USD 135,000",Glen Lorne, Harare North,,,,
Spacious 6-Bedroom Chiredzi Home with Pool on 4600 m² Lot,"USD 120,000",Chiredzi,,"4,600 m²",,,
Belvedere House For Sale,"USD 275,000",Belvedere, Harare West,400 m²,,,
Stand For Sale,"USD 60,000",Waterfalls, Harare South,,,,
Family home!!!,"USD 215,000",Hatfield, Harare South,,,,
"607 m² Residential Stand in Westgate, Harare West with Borehole","USD 65,000",Westgate, Harare West,,,,
"Exclusive Opportunity: Operational Beachfront Lodge for Sale – Jardim das Velas, Beira, Mozambique",P.O.A.,Mozambique,,900 m²,,,
4 bed Westgate Fair view House,"USD 175,000",Fairview, Harare West,600 m²,,,
Breathtaking Land For Sale In An Upmarket Suburb,"USD 160,000",Carrick Creagh, Harare North,,,,
Modern Cluster Home For Sale,"USD 225,000",Greendale, Harare East,150 m²,,,
Spacious Apartment for Sale – Prime Location in Harare!,"USD 295,000",Newlands, Harare North,225 m²,,,
Glen Lorne stands for sale,"USD 40,000",Glen Lorne, Harare North,,,,
Residential Stands In Chikanga-Along Magamba Road.,USD 60,Chikanga, Mutare,,,,
House For Sale,"USD 28,000",Kuwadzana, Harare High Density,40 m²,,,
Escape To The Country,"USD 171,150",Arcturus,,,,,
Well appointed family home with spacious living in Borrowdale Brooke,"USD 1,950,000",Borrowdale Brooke, Harare North,600 m²,,,
Great Starter Home for Sale,"USD 90,000",Zimre Park, Harare East,500 m²,,,
New Marlborough house for sale,"USD 130,000",New Marlborough, Harare West,280 m²,,,
Spacious 5-Bedroom Home For Sale In New Marlboroug,"USD 235,000",New Marlborough, Harare West,,,,
Elegant 4 Bed/2 Bath Mount Pleasant Home,"USD 450,000",Mount Pleasant, Harare North,300 m²,,,
Greendale Athlone Property for Sale (located at the periphery of Athlone Shops,"USD 240,000",Greendale, Harare East,,,,
Spacious 4-Bedroom Family Home in Eastlea with Borehole and Cottage!,"USD 350,000",Eastlea, Harare East,250 m²,,,
Exciting Property For Holiday Home Or Resort,"USD 145,000",Darwendale,,,,,
Magnificent Modern Home,"USD 650,000",Brookview, Harare North,,,,
Luxurious Brookview Estate for Sale,"USD 600,000",Brookview, Harare North,"2,050 m²",,,
Peaceful Oasis For Sale,"USD 880,000",Belgravia, Harare North,,,,
Borrowdale Brooke,"USD 280,000",Borrowdale Brooke, Harare North,,,,
"Head Office or Home, Discover Your Dream Property in Newlands!","USD 995,000",Newlands, Harare North,600 m²,,,
Vacant and Ready to Build Stands,"USD 15,000",Hertifordshire, Gweru,,,,
Mlibizi Holiday Retreat,"USD 85,000",Milibizi, Kariba,450 m²,,,
Great investment,"USD 35,000",Sandton Park, Harare West,,,,
Fine Living in the Highlands Park Neighbourhood,"USD 450,000",Highlands, Harare North,252 m²,,,
Dawnview Park 4 Bedroom House For Sale*,"USD 110,000",Dawnview Park, Harare West,267 m²,,,
3 Bedroom House for Sale in Zimre Park,"USD 110,000",Zimre Park, Harare East,290 m²,,,
Hogerty Hills  Borrowdale house for Sale,"USD 590,000",Hogerty Hill, Harare North,,,,
