Title,Price,Neighbourhood,City,Building Area,Land Area,Bedrooms,Bathrooms
Golf Estate Development Opportunity,"USD 3,900,000",Hatfield, Harare South,,,,
service station for sale along major highway,"USD 2,100,000",Glaudina, Harare West,400 m²,,,
Prime Commercial Land for Sale with Masvingo Road Frontage,"USD 1,000,000",Waterfalls, Harare South,,,,
Industrial Property for sale in Ardbennie Harare,"USD 750,000",Ardbennie, Harare South,,,,
Adelaide Park house for Sale perfect for Renovators,"USD 55,000",Adelaide Park, Ruwa,250 m²,,,
Half an acre plot with an old double storey house and a 3 beds cottage For Sale,"USD 225,000",Helensvale, Harare North,,,,
Carrick creagh residential stand for sale,"USD 120,000",Borrowdale, Harare North,,,,
"Land reserved for flats parent title available ,joint partnerships are welcome","USD 600,000",Knowe, Norton,,,,
Elegant 5 Bedroom Guest Lodge / Family Retreat on an acre ideally situated.,"USD 850,000",Colne Valley, Harare North,800 m²,,,
Charming Hotel  for Sale in Bulawayo – Spacious 695 m² Land,"USD 1,689,000",Bulawayo City Centre, Bulawayo CBD,,,,
Belgravia House For Sale,"USD 780,000",Belgravia, Harare North,"3,905 m²",,,
Paddonhurst80,"USD 80,000",Paddonhurst, Bulawayo North,1 m²,,,
Spitzkop,"USD 11,000",Spitzkop, Harare West,,,,
"Silverbrooke along Mutare RoadPrime 1000 m² Residential Land for Sale in Ruwa, Zimbabwe**","USD 37,000",Ruwa,,,,,
Charming Classic Home with Endless Potential in Ruwa's Sought-After Windsor Park!,"USD 200,000",Old Windsor, Ruwa,150 m²,,,
House for sale,"USD 50,000",Dzivarasekwa, Harare High Density,120 m²,,,
Tynwald Falcon estate house for sale,"USD 150,000",Tynwald, Harare West,350 m²,,,
Carrick Creagh mansion for sale,"USD 650,000",Carrick Creagh, Harare North,700 m²,,,
Superbly Located Property -Adjacent to Fully Commercial Property on King George Road,"USD 1,200,000",Cork Road, Avondale,"1,600 m²",,,
4 beds Exclusive Townhouses/Cluster conviniently located,"USD 425,000",Chisipite, Harare North,278 m²,,,
"Prime Sunway City Harare Land with Borehole,Deeds & 3 Cottages with Rental Income: 3087m²","USD 160,000",Sunway City, Harare East,,,,
Great investment,"USD 45,000",Norton,,120 m²,,,
Cluster Stand for Sale In GREYSTONE PARK,"USD 60,000",Greystone Park, Harare North,,,,
Kintyre 10 Hectares of Land with Bulawayo main Road Frontage between  Norton and Harare,"USD 400,000",Zvimba,,,,,
Mt Pleasant off The Chase Road for sale,"USD 240,000",Mount Pleasant, Harare North,500 m²,,,
Discover Your Ideal Family Home in Gunhill,P.O.A.,Gunhill, Harare North,,,,
Luxury Townhouse for Sale,"USD 350,000",Avondale, Harare North,270 m²,,,
"13 Hectare Residential Land for Sale in Glaudina, Harare West","USD 1,500,000",Glaudina, Harare West,,,,
Vainona sub division Pan handle,"USD 210,000",Vainona, Harare North,,,,
Great investment opportunity!!!,"USD 480,000",Umwinsidale, Harare North,,,,
"Elegant & Spacious: Dream Home in Borrowdale, Also suitable for Offices!","USD 900,000",Borrowdale, Harare North,"1,300 m²",,,
"Luxury 7-Bedroom Double Story House for Sale in Matsheumhlope, Bulawayo","USD 280,000",Matsheumhlope, Bulawayo East,900 m²,,,
"Stunning Duplex Property for Sale in Granite Park, Bulawayo!","USD 315,000",Hillside, Bulawayo South,400 m²,,,
Avondale First-Floor Flat with Garage & Borehole,"USD 75,000",Avondale, Harare North,60 m²,,,
Great Location -Upper Avenues,"USD 215,000",Avenues, Harare CBD,154 m²,,,
Westgate Haydon park 90% complete 4beds all beds ensuites house 4sale,"USD 125,000",Haydon Park, Harare West,500 m²,,,
A choice of Residential stands for sale in Mary Park Estate,"USD 66,000",Knowe, Norton,,,,
Secure Your Dream In Aspindale.,"USD 90,000",Aspindale Park, Harare West,150 m²,,,
Strategic Property for Sale on Mutare Road,"USD 1,100,000",Ruwa,,"2,000 m²",,,
"Prime Warehouse & Factory Space For Sale in RUWA, Harare","USD 2,700,000",Ruwa,,"18,000 m²",,,
Apartments For Sale in Highlands,"USD 425,000",Highlands, Harare North,500 m²,,,
Avonlea Gem For Sale,"USD 210,000",Avonlea, Harare West,"1,405 m²",,,
Conveniently located  apartment in Avondale,"USD 200,000",Avondale, Harare North,,,,
Available stands for sale  in Arlington East Choice of 3stands,"USD 93,600",Arlington, Harare South,,,,
Elevated Elegance,"USD 320,000",Burnside, Bulawayo East,,,,
"Two-Storey Factory for Sale in Belmont, Bulawayo","USD 690,000",Belmont, Bulawayo CBD,,,,
Charlotte Brooke- Incomplete House with Great Potentail,"USD 85,000",Charlotte Brooke, Harare North,347 m²,,,
Elegant 3-Bedroom Townhouse in Prime Borrowdale,"USD 260,000",Borrowdale West, Harare North,160 m²,,,
A Hidden Gem,"USD 230,000",Riverside South, Bulawayo East,1 m²,,,
**Prime 2500 m² Stand in Serene Borrowdale: Build Your Dream Home!**,"USD 125,000",Borrowdale, Harare North,,,,
An Opportunity to Complete Your Dream Home,"USD 60,000",Mahatshula, Bulawayo North,,,,
Bluffhill,"USD 450,000",Bluff Hill, Harare West,"3,000 m²",,,
Commercial stand in Waterfalls with main road frontage,"USD 250,000",Waterfalls, Harare South,,,,
Prime Commercial Avondale Head Office Option,"USD 620,000",Avondale, Harare North,600 m²,,,
Flat For Sale,"USD 70,000",Avenues, Harare CBD,50 m²,,,
"4-Bed main ensuite Luxury Townhouse with Unique Features in Arlington, Harare","USD 155,000",Arlington, Harare South,219 m²,,,
Stunning Helensvale Home,"USD 1,100,000",Helensvale, Harare North,600 m²,,,
Build your dream home!,"USD 66,000",Rainham, Harare West,200 m²,,,
Prominent Southerton Property,"USD 3,000,000",Southerton, Harare South,"5,261 m²",,,
"6 Acres - Premium, Executive Estate on Carrick Creagh Road, Helensvale","USD 4,500,000",Carrick Creagh, Harare North,"2,000 m²",,,
Strategic Zindoga Commercial Property – Harare,"USD 1,420,000",Waterfalls, Harare South,950 m²,,,
Smart Luxury Living in Marlborough – Double-Storey Home,"USD 250,000",Marlborough, Harare West,600 m²,,,
Craft Your Dream Sanctuary: A Majestic Miombo Woodland Estate in Prime Glen Lorne,"USD 500,000",Glen Lorne, Harare North,,,,
Flats for sale,"USD 220,000",Monavale, Harare West,220 m²,,,
Invest in a better life ! invest in Folyjon Crescent,"USD 690,000",Glen Lorne, Harare North,,,,
"2145 m² Stand in Knowe with title deeds, Norton !","USD 30,000",Knowe, Norton,,,,
"Prime 1250 m² Residential Land for Sale in Bindura, Mashonaland Central","USD 18,000",Bindura,,,,,
Norton,"USD 35,000",Norton,,,,,
Excellent Location and Rental Return Msasa,"USD 1,600,000",Whites Way, Msasa,"3,859 m²",,,
3-Bedroom House For Sale In Hillside,"USD 230,000",Hillside, Harare South,,,,
Elegant Double-Storey Home on Expansive Grounds,"USD 950,000",Pomona, Harare North,"4,335 m²",,,
**Luxury Family Home with Pool in Suburban Mount Pleasant**,"USD 570,000",Mount Pleasant, Harare North,450 m²,,,
Upmarket Real Estate,"USD 355,000",Greendale North, Harare North,"4,580 m²",,,
Quick Sale ..,"USD 50,000",Rockview, Harare East,,,,
Investment Opportunity,"USD 1,000,000",Whitecliff, Harare West,,,,
"513sqm phase 2 in Arlington East,fully developed with roads,sewer and water","USD 50,000",Arlington, Harare South,,,,
Great Investment Potential,"USD 290,000",Borrowdale, Harare North,,,,
"1 Hectare Land for Sale in Kensington, Bulawayo East","USD 32,000",Kensington, Bulawayo East,,,,
Luxurious Borrowdale Triple Storey Mansion,"USD 950,000",Borrowdale, Harare North,"1,000 m²",,,
"Residential Land for Sale in Pomona, Nyeredzi Ridge  Harare -","USD 50,000",Pomona, Harare North,,,,
"2,3ha Gumtree Clare Mont","USD 75,000",Gumtree, Bulawayo East,,,,
Partialy Built House for Sale,"USD 90,000",Rockview, Harare East,400 m²,,,
Newlands Cluster Apartment,"USD 90,000",Newlands, Harare North,200 m²,,,
Ruwa Commercial Plot For Sale,"USD 1,500,000",Ruwa,,,,,
Residential Stand for Sale – Norton Galloway,"USD 35,000",Galloway, Norton,,,,
Charming Solid Brick Under Tile Home with Endless Potential!!!!,"USD 150,000",Amby, Harare East,250 m²,,,
Strathaven House For Sale,"USD 260,000",Strathaven, Harare West,"1,700 m²",,,
"Charming 3-Bedroom Family Home in Mabvazuva, Ruwa for Sale!","USD 105,000",Mabvazuva, Ruwa,,,,
Embrace the Charm of New Marlborough,"USD 100,000",Biriwiri Avenue, New Marlborough,250 m²,,,
Dzivarasekwa Stands Negotiable,"USD 12,000",Dzivarasekwa, Harare High Density,,,,
Goromonzi Commercial Property For Sale,"USD 150,000",Goromonzi,,800 m²,,,
Rydale Ridge,"USD 18,000",Rydale Ridge, Harare High Density,,,,
Residential Land for Sale in Greystone Park,"USD 480,000",Greystone Park, Harare North,,,,
Greendale Property For Sale,"USD 350,000",Greendale North, Harare North,300 m²,,,
Haydon park Close to the New Parliament,"USD 150,000",Haydon Park, Harare West,900 m²,,,
**Modern Family Home in Strathaven with Borehole – A Must-See!**,"USD 280,000",Strathaven, Harare West,180 m²,,,
"Reduced Price To Go – Fuel Depot for Sale in Belmont, Bulawayo","USD 850,000",Belmont, Bulawayo CBD,"1,000 m²",,,
Prime Agro-Plots,"USD 25,000",Shamva,,,,,
Investment opportunity,"USD 35,000",Chitungwiza,,180 m²,,,
Great Investment Opportunity,"USD 85,000",Goodhope, Harare West,,,,
Commercial industrial stand for sale,"USD 100,000",Sandton Park, Harare West,,,,
Ultimate Water Side Living,"USD 525,000",Matsheumhlope, Bulawayo East,,,,
4-Bed Home needing TLC in Mount Pleasant with Pool & Borehole,"USD 390,000",Mount Pleasant, Harare North,500 m²,,,
"Perfect Agricultural , Industrial or Development opportunity","USD 850,000",Ruwa,,,,,
hatfield 3 bedroomed house close to seke rd,"USD 220,000",Hatfield, Harare South,800 m²,,,
Ready to Build Stand measuring 3218sqm,"USD 155,000",Pomona, Harare North,,,,
Exceptional Land For Sale in Glenforest,"USD 4,000,000",Glen Forest, Harare North,,,,
Stand For Sale In Scenic Charlotte Brooke,"USD 18,000",Charlotte Brooke, Harare North,,,,
House for sale (On Show),"USD 150,000",Hatfield, Harare South,600 m²,,,
5 Bedroom House in Athlone Greendale,"USD 250,000",Athlone, Harare East,"4,896 m²",,,
Prime Commercial Land  For Sale In Avenues,"USD 490,000",Avenues, Harare CBD,,,,
Ivory Park Residentual Stands For Sale,"USD 17,500",Amalinda, Harare High Density,,,,
Prime Arlington Estate Stand for Sale!!!,"USD 65,000",Arlington, Harare South,,,,
New Upcoming Housing Project,"USD 16,000",Nyabira,,,,,
Neat as a pin,"USD 300,000",Matsheumhlope, Bulawayo East,600 m²,,,
Negotiations makes it yours,"USD 100,000",Bloomingdale, Harare West,200 m²,,,
Cold comfort ready to build,"USD 60,000",Cold Comfort, Harare West,,,,
**Prime 7000 m² Commercial Land in Chitungwiza don’t Miss Out!**,"USD 75,000",Chitungwiza,,,,,
House for sale,"USD 47,000",Zengeza, Chitungwiza,300 m²,,,
Cranborne House for sale.,"USD 120,000",Cranborne, Harare South,,,,
CBD flat for sale,"USD 70,000",Avenues, Harare CBD,50 m²,,,
Commercial Property for Sale - Mutare Avenues,"USD 260,000",Avenues, Mutare,550 m²,,,
Stand for Sale in Crohill views,"USD 30,000",Crowhill Views, Harare North,,,,
"Prime 10,000m² Commercial Land along Seke Road, Harare South","USD 230,000",Hatfield, Harare South,,,,
Prime 2000m² Glen Lorne Land with  A Prolific Borehole,"USD 175,000",Glen Lorne, Harare North,,,,
"Charming bachelor Flats in Ashdown Park,from 50k","USD 50,000",Ashdown Park, Harare West,40 m²,,,
**Prime 1800m² Stand in Sandton Park with Essential Amenities**,"USD 65,000",Sandton Park, Harare West,,,,
2058sqm Stand For Sale In Manresa,"USD 60,000",Manresa, Harare East,,,,
Looking for a depot for long distance haulage or offices,"USD 490,000",Beitbridge,,,,,
House for sale Christon bank,"USD 1,600,000",Christon Bank,,600 m²,,,
Stylish 3-Bedroom Townhouse in Hatfield with Borehole Access,"USD 135,000",Hatfield, Harare South,170 m²,,,
Partially built house in Rockview,"USD 65,000",Rockview, Harare East,400 m²,,,
Spacious 2 Bedroomed Unit Nestled In Quinnington,"USD 180,000",Quinnington, Harare North,95 m²,,,
New On The Market - Sole Mandate - Ideal For Offices/Residential,"USD 450,000",Mount Pleasant, Harare North,,,,
Crowhill Stands for sale,"USD 17,000",Crowhill Views, Harare North,,,,
Vacant Stand,"USD 48,000",Fairview, Harare West,,,,
Stand for sale!!!,"USD 120,000",Arlington, Harare South,,,,
"Spacious 4-Bedroom House for Sale in Avenues, Harare CBD","USD 410,000",Avenues, Harare CBD,,,,
Unique Industrial Opportunity In Southerton,"USD 1,600,000",Southerton, Harare South,"2,790 m²",,,
Premier Business Space In Strategic Position,"USD 690,000",Belmont, Bulawayo CBD,,,,
Your Dream Home or Head Office In Chisipite,"USD 540,000",Chisipite, Harare North,300 m²,,,
3-Bed House For Sale In Westgate,"USD 160,000",Westgate, Harare West,600 m²,,,
"Charming 2-Bed cottage Home in Kutandara, Harare with Carport","USD 75,000",Kutandara, Harare West,150 m²,,,
Brookeridge Estate Land For Sale,"USD 590,000",Philadelphia, Harare North,,,,
"Prime 35,000 m² Chinhoyi Land: Perfect for a school!","USD 1,225,000",Chinhoyi,,,,,
**Prime 300 m² Stand for Sale in Nyabira - Your Dream Home Awaits!**,"USD 17,000",Nyabira,,,,,
"Prime 1799m² Residential Land for Sale in Pomona, Harare North","USD 56,000",Pomona, Harare North,,,,
Plot For Sale,"USD 50,000",Ruwa,,,,,
"Spacious Warehouse & Factory for Sale in Ardbennie, Harare South","USD 280,000",Ardbennie, Harare South,,,,
Sound Investment property situated on a main road,"USD 1,200,000",Highlands, Harare North,,,,
Prime 300m² Land in Rydale Ridge—Your Future Awaits!,"USD 12,000",Rydale Ridge, Harare High Density,,,,
Fairview Haydon shineplus estate stands for sale,"USD 48,000",Haydon Park, Harare West,,,,
Windermere Hotel along Vic Falls Road Bulawayo,"USD 300,000",Umguza, Bulawayo North,"2,800 m²",,,
Garden Flat for sale in Greendale,"USD 140,000",Greendale North, Harare North,350 m²,,,
"Prime 1799m² Residential Land for Sale in Pomona, Harare North","USD 56,000",Pomona, Harare North,,,,
Plot For Sale,"USD 50,000",Ruwa,,,,,
"Spacious Warehouse & Factory for Sale in Ardbennie, Harare South","USD 280,000",Ardbennie, Harare South,,,,
Sound Investment property situated on a main road,"USD 1,200,000",Highlands, Harare North,,,,
Prime 300m² Land in Rydale Ridge—Your Future Awaits!,"USD 12,000",Rydale Ridge, Harare High Density,,,,
Fairview Haydon shineplus estate stands for sale,"USD 48,000",Haydon Park, Harare West,,,,
Windermere Hotel along Vic Falls Road Bulawayo,"USD 300,000",Umguza, Bulawayo North,"2,800 m²",,,
Garden Flat for sale in Greendale,"USD 140,000",Greendale North, Harare North,350 m²,,,
Pioneering Industrial Excellence,"USD 1,200,000",Belmont East, Bulawayo South,,,,
Ready to built,"USD 35,000",Norton,,,,,
Land for Townhouses.,"USD 140,000",Four Winds, Bulawayo South,,,,
Mufakose Starter Home For Sale,"USD 23,000",Mufakose, Harare High Density,90 m²,,,
"1000 m² Residential Stand for Sale in Prime Ruwa, Mashonaland East","USD 35,000",Ruwa,,,,,
"A Modern Oasis, Inside and Out","USD 455,000",Arlington, Harare South,750 m²,,,
School building in Letombo Park,"USD 235,000",Msasa, Harare East,600 m²,,,
Marlborough Mountbatern Mews Property For Sale,"USD 185,000",Marlborough, Harare West,300 m²,,,
Vacant residential stand,"USD 45,000",Whitecliff, Harare West,,,,
Borrowdale Stand For Sale,"USD 125,000",Borrowdale, Harare North,,,,
Prime Location High-Potential On Chisipite,"USD 600,000",Chisipite, Harare North,200 m²,,,
Northend,"USD 70,000",Northend, Bulawayo North,,,,
"Prime 1799m² Residential Land for Sale in Pomona, Harare North","USD 56,000",Pomona, Harare North,,,,
Plot For Sale,"USD 50,000",Ruwa,,,,,
"Spacious Warehouse & Factory for Sale in Ardbennie, Harare South","USD 280,000",Ardbennie, Harare South,,,,
Sound Investment property situated on a main road,"USD 1,200,000",Highlands, Harare North,,,,
Prime 300m² Land in Rydale Ridge—Your Future Awaits!,"USD 12,000",Rydale Ridge, Harare High Density,,,,
Fairview Haydon shineplus estate stands for sale,"USD 48,000",Haydon Park, Harare West,,,,
Windermere Hotel along Vic Falls Road Bulawayo,"USD 300,000",Umguza, Bulawayo North,"2,800 m²",,,
Garden Flat for sale in Greendale,"USD 140,000",Greendale North, Harare North,350 m²,,,
Pioneering Industrial Excellence,"USD 1,200,000",Belmont East, Bulawayo South,,,,
Ready to built,"USD 35,000",Norton,,,,,
Land for Townhouses.,"USD 140,000",Four Winds, Bulawayo South,,,,
Mufakose Starter Home For Sale,"USD 23,000",Mufakose, Harare High Density,90 m²,,,
"1000 m² Residential Stand for Sale in Prime Ruwa, Mashonaland East","USD 35,000",Ruwa,,,,,
"A Modern Oasis, Inside and Out","USD 455,000",Arlington, Harare South,750 m²,,,
School building in Letombo Park,"USD 235,000",Msasa, Harare East,600 m²,,,
Marlborough Mountbatern Mews Property For Sale,"USD 185,000",Marlborough, Harare West,300 m²,,,
Vacant residential stand,"USD 45,000",Whitecliff, Harare West,,,,
Borrowdale Stand For Sale,"USD 125,000",Borrowdale, Harare North,,,,
Prime Location High-Potential On Chisipite,"USD 600,000",Chisipite, Harare North,200 m²,,,
Northend,"USD 70,000",Northend, Bulawayo North,,,,
"Prime 1799m² Residential Land for Sale in Pomona, Harare North","USD 56,000",Pomona, Harare North,,,,
Plot For Sale,"USD 50,000",Ruwa,,,,,
"Spacious Warehouse & Factory for Sale in Ardbennie, Harare South","USD 280,000",Ardbennie, Harare South,,,,
Sound Investment property situated on a main road,"USD 1,200,000",Highlands, Harare North,,,,
Prime 300m² Land in Rydale Ridge—Your Future Awaits!,"USD 12,000",Rydale Ridge, Harare High Density,,,,
Fairview Haydon shineplus estate stands for sale,"USD 48,000",Haydon Park, Harare West,,,,
Windermere Hotel along Vic Falls Road Bulawayo,"USD 300,000",Umguza, Bulawayo North,"2,800 m²",,,
Garden Flat for sale in Greendale,"USD 140,000",Greendale North, Harare North,350 m²,,,
Pioneering Industrial Excellence,"USD 1,200,000",Belmont East, Bulawayo South,,,,
Ready to built,"USD 35,000",Norton,,,,,
Land for Townhouses.,"USD 140,000",Four Winds, Bulawayo South,,,,
Mufakose Starter Home For Sale,"USD 23,000",Mufakose, Harare High Density,90 m²,,,
"1000 m² Residential Stand for Sale in Prime Ruwa, Mashonaland East","USD 35,000",Ruwa,,,,,
"A Modern Oasis, Inside and Out","USD 455,000",Arlington, Harare South,750 m²,,,
School building in Letombo Park,"USD 235,000",Msasa, Harare East,600 m²,,,
Marlborough Mountbatern Mews Property For Sale,"USD 185,000",Marlborough, Harare West,300 m²,,,
Vacant residential stand,"USD 45,000",Whitecliff, Harare West,,,,
Borrowdale Stand For Sale,"USD 125,000",Borrowdale, Harare North,,,,
Prime Location High-Potential On Chisipite,"USD 600,000",Chisipite, Harare North,200 m²,,,
Northend,"USD 70,000",Northend, Bulawayo North,,,,
School building in Letombo Park,"USD 235,000",Msasa, Harare East,600 m²,,,
Marlborough Mountbatern Mews Property For Sale,"USD 185,000",Marlborough, Harare West,300 m²,,,
Vacant residential stand,"USD 45,000",Whitecliff, Harare West,,,,
Borrowdale Stand For Sale,"USD 125,000",Borrowdale, Harare North,,,,
Prime Location High-Potential On Chisipite,"USD 600,000",Chisipite, Harare North,200 m²,,,
Northend,"USD 70,000",Northend, Bulawayo North,,,,
Residential house for sale,"USD 85,000",Zimre Park, Harare East,150 m²,,,
Reduced to go ..suitable  for cluster homes !,"USD 380,000",Greendale, Harare East,600 m²,,,
Plumtree Stands For Sale,"USD 10,000",Plumtree,,,,,
Stands for Sale,"USD 70,000",Gletwin Park, Harare North,,,,
Ready to build on good soils.,"USD 40,000",Windsor Park, Ruwa,,,,
100 Residential Stands For Sale In Glen View 1 Ext,"USD 12,500",Glen View, Harare High Density,,,,
Thatched Offices In The Heart Of Victoria Falls,"USD 550,000",Victoria Falls,,,,,
Secure Your Future,"USD 28,000",Emganwini, Bulawayo High-Density,,,,
Newly Renovated Studio Flat for Sale,"USD 40,000",Harare City Centre, Harare CBD,50 m²,,,
Prime Development Opportunity in Greendale,"USD 360,000",Greendale, Harare East,200 m²,,,
This magnificent property is one of a kind and well-worth a view!,"USD 2,150,000",Borrowdale Brooke, Harare North,500 m²,,,
Fuel station for sale,"USD 1,300,000",Chitungwiza,,"1,000 m²",,,
Plots For Sale,"USD 288,000",Goromonzi,,,,,
Borrowdale Greystone Park Stand For Sale.,"USD 140,000",Greystone Park, Harare North,,,,
kingsdale plot for sale,"USD 139,000",Kingsdale, Bulawayo North,,,,
Shops For Sale In Cbd,"USD 675,000",Harare City Centre, Harare CBD,400 m²,,,
3 bedroomed house and land for sale in Tynwald South,"USD 170,000",Tynwald, Harare West,,,,
Elegant Family Home In Borrowdale Brooke,"USD 2,000,000",Borrowdale Brooke, Harare North,800 m²,,,
St Mary’s Commercial/Industrial Property Near Huruyadzo Shops,"USD 215,000",Chitungwiza,,500 m²,,,
Finish To Your Own Taste,"USD 120,000",Haydon Park, Harare West,200 m²,,,
"Prime Retail Property - 1,6 Million","USD 1,600,000",Harare City Centre, Harare CBD,"1,600 m²",,,
Stoneridge Stand,"USD 15,000",Stoneridge, Harare South,,,,
3 Bed Cluster All Ensuite With Modern Fittings,"USD 120,000",Hatfield, Harare South,140 m²,,,
Fairview Living Redefined,"USD 240,000",Fairview, Harare West,120 m²,,,
"Residential Land For Sale In Silverbrooke, Ruwa","USD 70,000",Mabvazuva, Ruwa,,,,
"Finish To Your Taste , House At Roof Level","USD 90,000",Sunway City, Harare East,500 m²,,,
Zimre Park House For Sale,"USD 140,000",Zimre Park, Harare East,400 m²,,,
Your Affordable Dream Home Awaits in Southlea Park.,"USD 28,000",Southlea Park, Harare South,138 m²,,,
Fairview Modern House,"USD 150,000",Fairview, Harare West,300 m²,,,
"Modern, Secure And Great Value","USD 240,000",Marlborough, Harare West,220 m²,,,
"Unfinished 4-Bedroom Family Home in Southview Park, Harare South","USD 42,000",Southview Park, Harare South,170 m²,,,
"2000sqm Stand For Sale, Kingcity, Sunninghill, Bulawayo","USD 35,000",Sunning Hill, Bulawayo East,,,,
"Prime Commercial Space for Sale in Ardbennie, Harare South, 7650 m²","USD 1,100,000",Ardbennie, Harare South,520 m²,,,
"Prime Industrial Investment Opportunity – Donnington West, Bulawayo","USD 350,000",Donnington, Bulawayo CBD,"9,402 m²",,,
Developers Dream...Ideal for Clusters,"USD 550,000",Hogerty Hill, Harare North,300 m²,,,
110 Hectares of Prime Agricultural Land in Mazowe!,"USD 430,000",Mazowe,,,,,
Stunning Newlands Townhouses for Sale | Prime Living,"USD 380,000",Newlands, Harare North,520 m²,,,
Kirkman Main Road Frontage.,"USD 255,000",Tynwald, Harare West,350 m²,,,
Charming family home!!!,"USD 550,000",Borrowdale, Harare North,,,,
Crowhill Views House for Sale,"USD 60,000",Crowhill Views, Harare North,220 m²,,,
House For Sale in Greendale,"USD 305,000",Greendale, Harare East,350 m²,,,
"An unbeatable opportunity for developers and investors, living luxuriously in a well developed area.","USD 25,000",Southdowns, Gweru,,,,
"Brand New, Cosy Family home","USD 90,000",Mabvazuva West, Springvale,380 m²,,,
"Spacious 4-Bedroom Townhouse in Serene Monavale, Harare West","USD 210,000",Monavale, Harare West,320 m²,,,
Connec Park Stands For Sale,"USD 11,620",Waterfalls, Harare South,,,,
The Perfect Home Does Exist,"USD 210,000",Colbell, Greendale,200 m²,,,
Expand Your Horizons: 177-Hectare Chakare Farm Awaiting You!,"USD 490,000",Chegutu,,,,,
Investment property in ideal location,"USD 750,000",Vainona, Harare North,,,,
Experience Luxury Living: Harare's Finest Development,"USD 360,000",Mount Pleasant, Harare North,385 m²,,,
Tynwald. 20 acres beautiful medium density land available,"USD 1,980,000",Tynwald, Harare West,,,,
Incomplete House At Ring Beam Level,"USD 80,000",Sandton Park, Harare West,360 m²,,,
Commercial Property with Endless Possibilities In The Heart Of Harare CBD,"USD 1,500,000",Harare City Centre, Harare CBD,"2,084 m²",,,
Stands for Sale,"USD 38,000",Pomona, Harare North,,,,
BARGAIN FARM FOR SALE – KWEKWE (875ha) $750 000*,"USD 750,000",KweKwe, Kwekwe,,,,
Build Your Dream Home: Generous 1-Acre Stand in Borrowdale,"USD 350,000",Borrowdale, Harare North,,,,
Prime House +  Land Package  In Chadcombe,"USD 350,000",Chadcombe, Harare South,,,,
Nyamandlovu Farm for sale,"USD 250,000",Nyamandlovu,,,,,
"Prime Residential Land for Sale in Nyabira, 616 m²","USD 27,000",Nyabira,,,,,
Residential Stand For Sale In Westwood Chiredzi,"USD 20,000",Chiredzi,,,,,
Solid family home!!!,"USD 200,000",Hillside, Harare South,,,,
Commercial property,"USD 260,000",Greendale, Harare East,520 m²,,,
Superb Opportunity,"USD 120,000",Madokero, Harare West,1 m²,,,
Premium Estate for Sale in Carrick Creagh,"USD 4,500,000",Carrick Creagh, Harare North,"2,500 m²",,,
Vacant Stand For Sale: Mzari Extension - 4442 sqm,"USD 60,000",Chinhoyi,,,,,
Contemorary architecture,"USD 350,000",Glen Lorne, Harare North,700 m²,,,
investment opportunity to a discerning investor,P.O.A.,Marlborough, Harare West,,,,
Hatfield Massive House,"USD 260,000",Hatfield, Harare South,250 m²,,,
?? Commercial Opportunity: Spacious Workshop and Office Area in Ruwa! ??,"USD 260,000",Ruwa,,800 m²,,,
Superbly Located Townhouse,"USD 550,000",Borrowdale, Harare North,,,,
Westgate goodhope House for sale,"USD 220,000",Goodhope, Harare West,800 m²,,,
An Industrial property with expansive warehousing spaces.,"USD 2,254,000",Workington, Harare South,"4,550 m²",,,
Excellent Choice For Business Location,"USD 7,000,000",Willowvale, Harare South,"18,000 m²",,,
Plot For Sale In Mvuma,"USD 60,000",Mvuma,,,,,
Lovely Stand In A.Built Up Area,"USD 35,000",Manningdale, Bulawayo East,,,,
Exceptional Investment Opportunity,"USD 650,000",Mount Pleasant, Harare North,600 m²,,,
Medium Density Residential Stand,"USD 28,000",Mahatshula, Bulawayo North,,,,
"Stand for Sale in Secure Gated Community, Chadcombe","USD 50,000",Chadcombe, Harare South,,,,
Finish To Taste Incomplete Property In Kutandara,"USD 75,000",Tynwald, Harare West,203 m²,,,
